work,venue_year,signal_source,control_target,hardware_primitive,scheduler_slack_used,accuracy_evidence,energy_evidence,suds_boundary
Lightening-Transformer,HPCA 2024,photonic Transformer datapath and DPTC scheduling,photonic tensor-core execution and conversion resources,dynamic full-range photonic tensor core,no,model/task evaluation in accelerator paper,architecture-level power/performance model,hardware architecture anchor; does not expose scheduler slack as quality budget
HyAtten,2025,signal amplitude / hybrid photonic-digital attention statistics,attention conversion and signal path,hybrid photonic-digital attention accelerator,no,attention accelerator validation,ADC/signal conversion overhead study,closest selector risk; SUDS must be framed as budget interface composing with signal selectors
ENLighten,2025,PTC-aware compression/sparsity,photonic accelerator sparsity/reconfiguration,sparse/reconfigurable photonic tensor core,no,ImageNet pruning/accuracy tradeoff,EDP and accelerator energy model,"complementary local compression and accelerator primitive, not scheduler-derived slack budget"
ASTRA,TECS 2025,stochastic photonic Transformer execution statistics,stochastic optical arithmetic and conversion,OAG/PCA/stochastic photonic Transformer pipeline,no,Transformer accelerator evaluation,component-level photonic energy model,useful PHY/ADC anchor; not a scheduler-quality interface
SCATTER/SONIC,2024/adjacent,"photonic NN robustness, crosstalk, and mapping constraints",optical link/path reliability and photonic NN mapping,silicon-photonic NN accelerator components,no,noise/crosstalk robustness studies,photonic component and link-budget models,defines PHY stress boundary; SUDS must not claim PHY closure from slack
DistServe/Mooncake/ECHO,serving systems,"request deadlines, SLOs, KV/cache and serving pressure",cluster/server scheduling and request placement,serving scheduler/runtime,"yes, at serving/runtime level",serving throughput/latency QoS,system/runtime efficiency where reported,"uses slack/SLO for scheduling, not accelerator-internal ADC/pruning control"
ADEPT / approximate-computing family,adjacent,"approximation tolerance, precision, or quality knobs",software/hardware approximation level,approximate compute and precision scaling,not as photonic accelerator-internal quality budget,application quality or accuracy tradeoff,approximate-compute energy/performance model,prior art for quality knobs; not the scoped scheduler-to-photonic-ADC interface
SUDS,this work,scheduler-derived layer/column timing slack plus optional local selectors,"ADC tier, SC prefix length, PRUNE/DEGRADE/KEEP resource budget",quality-budget sideband interface for photonic/DPTC accelerator resources,yes,MobileViT measured validation; GLUE boundary smoke; pending P2 multi-model matrix,modeled/calibrated ADC-tier and conversion/peripheral energy; pending P3 proxy lanes,"methodology/case-study claim; not silicon, SPICE, or new photonic accelerator SOTA"
