gate_id,gate,required,status,evidence,blockers,next_action
G0,Route lock and protected fallback,True,pass,plan=docs/coordination/active/SUDS_OPTICAL_TRANSFORMER_TETC_PIVOT_PLAN.md; reframe=paper/suds_tetc_architecture_reframe.md,,Create the pivot plan and reframe blueprint.
G1,Full TETC manuscript source,True,pass,fallback_title=The Missing Interface: Timing Slack as a Quality-Budget Signal for Photonic/DPTC Resource Control; tetc_source=paper/suds_tetc_architecture_manuscript.tex; tetc_title=Scheduler-Derived Budget Interfaces for Dynamic Photonic Transformer Accelerators; g1_release=pass; red_team=pass; public_repro=pass/pass,,"Keep the architecture-first TETC source promoted only while manuscript, red-team, and public-repro alignment artifacts pass."
G2,Two Transformer workloads on governed MPS,True,pass,"MobileViT rows=192/192; GLUE tasks=sst2,mrpc,mnli,qqp,qnli,rte; devices=mps; BERT architecture link rows=126",,Keep GLUE as measured MPS accuracy and architecture-modeled energy; rerun only if perturbation policy changes.
G3,System-level PPA advantage,True,pass,"artifact=experiments/results/report_data/suds_transformer_architecture_sim_20260513_tetc_pivot.json; workloads=bert_base_glue_seq128,mobilevit_s_transformer_blocks_256; terms=adc,dac_mzm,detector_tia,laser,memory,optical_link,control_sideband,digital_fallback; min_pessimistic_edp_gain=14.602%; design_space_rows=4536; pareto_rows=594",,Use the architecture simulator summary table as the promoted system-level PPA surface.
G4,Strong baselines and ablations,True,pass,"MobileViT conditions=e0_dense,e2_l1,e3_slack,e4_suds,e5_random,e6_signal,e7_overlay,e8_overflow; architecture conditions=astra_boundary,hyatten_style,l1,lightening_dptc,random,signal_only,slack_only,suds_l1,suds_only,suds_pareto,suds_signal,tempo_time_multiplexed,uniform_4bit,uniform_8bit; HyAtten artifact conditions=composition_summary,e6_signal,e7_overlay,e8_overflow",,"Keep signal-only wins as composition-boundary evidence, not slack-only superiority."
G5,SPICE/RTL/PHY calibration tied to architecture parameters,True,pass,"ADC bits=4,6,8; RTL cells=155; PHY pass ratio=0.601; architecture params=adc4_pj,adc6_pj,adc8_pj,astra_stochastic_boundary,control_pj_per_sideband_group,cores_per_tile,dac_pj,enlighten_l1_boundary,frequency_ghz,hyatten_low_resolution_fraction,lightening_adc_temporal_factor,phy_nominal_pass_ratio,phy_pessimistic_laser_multiplier,selected_adc_sharing,selected_sideband_group_cols,sram_global_kib,sram_subarray_kib,tempo_time_multiplexing_boundary,tile_dim,tiles",,Preserve ADC/RTL/PHY as calibration and boundary evidence only.
G6,Target journal fit,False,pass,Primary route is IEEE TETC; TC is stretch; JSA/protected JETC-methodology package is fallback.,,Recheck CAS/JCR partition in institutional database before final submission.
